{
  "format": "izle-bundle",
  "formatVersion": 1,
  "catalogId": "izle-example",
  "buildId": "20261021-37caeb9c",
  "builtAt": "2026-10-21T12:00:00Z",
  "name": "izle resolver example",
  "defaults": {
    "uiLanguage": "en",
    "preferredAudioLanguage": "en"
  },
  "adapters": [
    "example"
  ],
  "items": "items.json",
  "assetsDir": "assets"
}
